{
  "schema": "uads.review-record",
  "schemaVersion": "0.3.0",
  "reviewId": "rv_d46ca0dd40d25723",
  "projectId": "58233072c1c707ff",
  "workOrderId": "wo_9bfd07a91b9b364f",
  "executionRunId": "er_8ce6f0a2afdfc930",
  "changeDigest": "4bc0e58695a2f39eb793091d78a91f93bb397703a54c6490cf75a2e4619e915a",
  "reviewerRole": "independent-reviewer",
  "reviewSessionId": "wo001-low-reviewer",
  "implementerRole": "implementation-agent",
  "implementerSessionId": "wo001-low-implementer",
  "verdict": "APPROVED",
  "summary": "V1 LOW documentation change is bounded and static evidence passed.",
  "findings": [],
  "reasonCodes": [],
  "evidenceRefs": [
    "sidecar://execution-runs/er_8ce6f0a2afdfc930/evidence/ev_a4f01df54d73b35c.json"
  ],
  "createdAt": "2026-09-09T15:20:43.207Z"
}
